{
  "schema_version": "1.0.0",
  "report_mode": "report-only",
  "generated_at": "2026-06-27T13:27:57.132033+00:00",
  "repository": "local",
  "branch": "work",
  "commit_sha": "abac13d12e95c76c184f06d540460456e458f465",
  "scope": [
    "runtime_health",
    "delivery_evidence",
    "readiness",
    "completion",
    "burndown"
  ],
  "summary": {
    "mapped_sources": 545,
    "mapped_artifacts": 4,
    "category_coverage": {
      "runtime_health": 325,
      "delivery_evidence": 466,
      "readiness": 197,
      "completion": 242,
      "burndown": 72
    },
    "maturity_percent": 50,
    "operational_risk": "low",
    "confidence_level": "high"
  },
  "correlations": [
    {
      "source_type": "workflow",
      "path": ".github/workflows/actions-auto-operator.yml",
      "categories": [
        "delivery_evidence"
      ],
      "status": "mapped",
      "operational_risk": "low",
      "confidence_level": "medium"
    },
    {
      "source_type": "workflow",
      "path": ".github/workflows/actions-deep-diagnostic.yml",
      "categories": [
        "delivery_evidence"
      ],
      "status": "mapped",
      "operational_risk": "low",
      "confidence_level": "medium"
    },
    {
      "source_type": "workflow",
      "path": ".github/workflows/actions-dispatcher.yml",
      "categories": [
        "completion"
      ],
      "status": "mapped",
      "operational_risk": "low",
      "confidence_level": "medium"
    },
    {
      "source_type": "workflow",
      "path": ".github/workflows/ai-assisted-product-decision-intelligence.yml",
      "categories": [
        "delivery_evidence"
      ],
      "status": "mapped",
      "operational_risk": "low",
      "confidence_level": "medium"
    },
    {
      "source_type": "workflow",
      "path": ".github/workflows/auth-azure-operational-gate.yml",
      "categories": [
        "runtime_health",
        "delivery_evidence"
      ],
      "status": "mapped",
      "operational_risk": "low",
      "confidence_level": "medium"
    },
    {
      "source_type": "workflow",
      "path": ".github/workflows/auto-public-runtime-evidence.yml",
      "categories": [
        "runtime_health",
        "delivery_evidence",
        "completion"
      ],
      "status": "mapped",
      "operational_risk": "low",
      "confidence_level": "medium"
    },
    {
      "source_type": "workflow",
      "path": ".github/workflows/auto-rerun-governed.yml",
      "categories": [
        "delivery_evidence"
      ],
      "status": "mapped",
      "operational_risk": "low",
      "confidence_level": "medium"
    },
    {
      "source_type": "workflow",
      "path": ".github/workflows/branch-protection-audit.yml",
      "categories": [
        "delivery_evidence",
        "readiness",
        "completion"
      ],
      "status": "mapped",
      "operational_risk": "low",
      "confidence_level": "medium"
    },
    {
      "source_type": "workflow",
      "path": ".github/workflows/ci-e2e.yml",
      "categories": [
        "delivery_evidence",
        "completion"
      ],
      "status": "mapped",
      "operational_risk": "low",
      "confidence_level": "medium"
    },
    {
      "source_type": "workflow",
      "path": ".github/workflows/ci-enterprise-fast.yml",
      "categories": [
        "delivery_evidence",
        "readiness"
      ],
      "status": "mapped",
      "operational_risk": "low",
      "confidence_level": "medium"
    },
    {
      "source_type": "workflow",
      "path": ".github/workflows/ci-enterprise-regression.yml",
      "categories": [
        "runtime_health",
        "delivery_evidence",
        "readiness"
      ],
      "status": "mapped",
      "operational_risk": "low",
      "confidence_level": "medium"
    },
    {
      "source_type": "workflow",
      "path": ".github/workflows/ci-fast-operational.yml",
      "categories": [
        "runtime_health",
        "delivery_evidence",
        "readiness"
      ],
      "status": "mapped",
      "operational_risk": "low",
      "confidence_level": "medium"
    },
    {
      "source_type": "workflow",
      "path": ".github/workflows/ci-governance-drift-guard.yml",
      "categories": [
        "runtime_health",
        "delivery_evidence",
        "readiness"
      ],
      "status": "mapped",
      "operational_risk": "low",
      "confidence_level": "medium"
    },
    {
      "source_type": "workflow",
      "path": ".github/workflows/ci-incident-intelligence.yml",
      "categories": [
        "runtime_health",
        "delivery_evidence",
        "completion"
      ],
      "status": "mapped",
      "operational_risk": "low",
      "confidence_level": "medium"
    },
    {
      "source_type": "workflow",
      "path": ".github/workflows/ci-lead-time-analytics.yml",
      "categories": [
        "delivery_evidence",
        "completion"
      ],
      "status": "mapped",
      "operational_risk": "low",
      "confidence_level": "medium"
    },
    {
      "source_type": "workflow",
      "path": ".github/workflows/ci-observability.yml",
      "categories": [
        "delivery_evidence",
        "readiness",
        "completion"
      ],
      "status": "mapped",
      "operational_risk": "low",
      "confidence_level": "medium"
    },
    {
      "source_type": "workflow",
      "path": ".github/workflows/ci-runtime-health-summary.yml",
      "categories": [
        "runtime_health",
        "delivery_evidence",
        "readiness",
        "completion"
      ],
      "status": "mapped",
      "operational_risk": "low",
      "confidence_level": "medium"
    },
    {
      "source_type": "workflow",
      "path": ".github/workflows/ci-security.yml",
      "categories": [
        "delivery_evidence",
        "completion"
      ],
      "status": "mapped",
      "operational_risk": "low",
      "confidence_level": "medium"
    },
    {
      "source_type": "workflow",
      "path": ".github/workflows/ci.yml",
      "categories": [
        "delivery_evidence",
        "completion"
      ],
      "status": "mapped",
      "operational_risk": "low",
      "confidence_level": "medium"
    },
    {
      "source_type": "workflow",
      "path": ".github/workflows/codex-local-online.yml",
      "categories": [
        "delivery_evidence",
        "completion"
      ],
      "status": "mapped",
      "operational_risk": "low",
      "confidence_level": "medium"
    },
    {
      "source_type": "workflow",
      "path": ".github/workflows/command-center-readiness.yml",
      "categories": [
        "runtime_health",
        "delivery_evidence",
        "readiness"
      ],
      "status": "mapped",
      "operational_risk": "low",
      "confidence_level": "medium"
    },
    {
      "source_type": "workflow",
      "path": ".github/workflows/configurar-fly-auth-azure.yml",
      "categories": [
        "runtime_health",
        "delivery_evidence"
      ],
      "status": "mapped",
      "operational_risk": "low",
      "confidence_level": "medium"
    },
    {
      "source_type": "workflow",
      "path": ".github/workflows/deep-governance-review.yml",
      "categories": [
        "runtime_health",
        "delivery_evidence"
      ],
      "status": "mapped",
      "operational_risk": "low",
      "confidence_level": "medium"
    },
    {
      "source_type": "workflow",
      "path": ".github/workflows/delivery-burndown-snapshot.yml",
      "categories": [
        "delivery_evidence",
        "burndown"
      ],
      "status": "mapped",
      "operational_risk": "low",
      "confidence_level": "medium"
    },
    {
      "source_type": "workflow",
      "path": ".github/workflows/delivery-completion-snapshot.yml",
      "categories": [
        "delivery_evidence",
        "readiness",
        "completion"
      ],
      "status": "mapped",
      "operational_risk": "low",
      "confidence_level": "medium"
    },
    {
      "source_type": "workflow",
      "path": ".github/workflows/delivery-evidence-report.yml",
      "categories": [
        "runtime_health",
        "delivery_evidence",
        "burndown"
      ],
      "status": "mapped",
      "operational_risk": "low",
      "confidence_level": "medium"
    },
    {
      "source_type": "workflow",
      "path": ".github/workflows/delivery-readiness-report.yml",
      "categories": [
        "delivery_evidence",
        "readiness",
        "burndown"
      ],
      "status": "mapped",
      "operational_risk": "low",
      "confidence_level": "medium"
    },
    {
      "source_type": "workflow",
      "path": ".github/workflows/delivery-status-report.yml",
      "categories": [
        "delivery_evidence",
        "completion"
      ],
      "status": "mapped",
      "operational_risk": "low",
      "confidence_level": "medium"
    },
    {
      "source_type": "workflow",
      "path": ".github/workflows/deploy-reqsys-showcase-pages.yml",
      "categories": [
        "delivery_evidence"
      ],
      "status": "mapped",
      "operational_risk": "low",
      "confidence_level": "medium"
    },
    {
      "source_type": "workflow",
      "path": ".github/workflows/dispatch-public-runtime-evidence.yml",
      "categories": [
        "runtime_health",
        "delivery_evidence"
      ],
      "status": "mapped",
      "operational_risk": "low",
      "confidence_level": "medium"
    },
    {
      "source_type": "workflow",
      "path": ".github/workflows/enterprise-runtime-governance-gates.yml",
      "categories": [
        "runtime_health",
        "delivery_evidence"
      ],
      "status": "mapped",
      "operational_risk": "low",
      "confidence_level": "medium"
    },
    {
      "source_type": "workflow",
      "path": ".github/workflows/evidence-analytics-drilldown-runtime.yml",
      "categories": [
        "runtime_health",
        "delivery_evidence",
        "readiness"
      ],
      "status": "mapped",
      "operational_risk": "low",
      "confidence_level": "medium"
    },
    {